{
  "schema_version": 1,
  "catalog_id": "lambda-ci-runner-class-catalog-v1",
  "status": "MODEL_ONLY_NOT_LIVE",
  "authority": "workspace-control",
  "generated_from": "architecture/github-actions-control-plane-system-model.v1.json",
  "invariants": [
    "all jobs in one runner class share one root launch envelope",
    "runner class is authenticated from local controller identity rather than request-provided workload text",
    "human ingress command parameters are never root provisioning inputs",
    "trusted workflow identity determines whether a job may be acquired into a class"
  ],
  "projects": {
    "research-engine": {
      "repository": "adamtrott78/research-engine",
      "runner_classes": {
        "research-cpu-public-v1": {
          "scale_set_name": "lambda-research-engine-cpu-public",
          "runner_prefix": "lambda-research-engine-cpu-public-",
          "max_runners": 1,
          "execution_contract_id": "cpu-public-ci-v1",
          "controller_peer": {
            "unix_user": "ci-ctl-re-cpu"
          },
          "bindings": {
            "model_id": null,
            "runtime_id": null
          }
        },
        "research-gpu-single-public-v1": {
          "scale_set_name": "lambda-research-engine-gpu-single-public",
          "runner_prefix": "lambda-research-engine-gpu-single-public-",
          "max_runners": 1,
          "execution_contract_id": "gpu-single-public-ci-v1",
          "controller_peer": {
            "unix_user": "ci-ctl-re-gpu-public"
          },
          "bindings": {
            "model_id": null,
            "runtime_id": null
          }
        },
        "research-gpu-single-runtime-v1": {
          "scale_set_name": "lambda-research-engine-gpu-single-runtime",
          "runner_prefix": "lambda-research-engine-gpu-single-runtime-",
          "max_runners": 1,
          "execution_contract_id": "gpu-single-public-ci-v1",
          "controller_peer": {
            "unix_user": "ci-ctl-re-gpu-runtime"
          },
          "bindings": {
            "model_id": null,
            "runtime_id": "qwen35-vllm-cu129-image-native-sampler-v3"
          }
        },
        "research-model-single-offline-v1": {
          "scale_set_name": "lambda-research-engine-model-single-offline",
          "runner_prefix": "lambda-research-engine-model-single-offline-",
          "max_runners": 1,
          "execution_contract_id": "model-single-offline-v1",
          "controller_peer": {
            "unix_user": "ci-ctl-re-model-single"
          },
          "bindings": {
            "model_id": "qwen3.5-4b",
            "runtime_id": "qwen35-vllm-cu129-image-native-sampler-v3"
          }
        },
        "research-model-dual-offline-v1": {
          "scale_set_name": "lambda-research-engine-model-dual-offline",
          "runner_prefix": "lambda-research-engine-model-dual-offline-",
          "max_runners": 1,
          "execution_contract_id": "model-dual-offline-v1",
          "controller_peer": {
            "unix_user": "ci-ctl-re-model-dual-off"
          },
          "bindings": {
            "model_id": "qwen3.5-4b",
            "runtime_id": "qwen35-vllm-cu129-image-native-sampler-v3"
          }
        },
        "research-model-dual-public-v1": {
          "scale_set_name": "lambda-research-engine-model-dual-public",
          "runner_prefix": "lambda-research-engine-model-dual-public-",
          "max_runners": 1,
          "execution_contract_id": "model-dual-public-v1",
          "controller_peer": {
            "unix_user": "ci-ctl-re-model-dual-pub"
          },
          "bindings": {
            "model_id": "qwen3.5-4b",
            "runtime_id": "qwen35-vllm-cu129-image-native-sampler-v3"
          }
        }
      },
      "routes": {
        "cpu-test": {
          "runner_class_id": "research-cpu-public-v1",
          "trusted_workflow": {
            "path": ".github/workflows/lambda-ci-p5-autonomous.yml",
            "default_branch": "main",
            "blob_sha": "eca9f11373a591a34a2e19c0eafe31e9e171f785",
            "job_key": "autonomous-cpu",
            "allowed_events": [
              "issue_comment"
            ],
            "allowed_actor_logins": [
              "adamtrott78"
            ]
          },
          "ingress": {
            "command": "/lambda-ci-p5",
            "parameter_schema_id": "candidate-sha-v1"
          }
        },
        "gpu-small": {
          "runner_class_id": "research-gpu-single-runtime-v1",
          "trusted_workflow": {
            "path": ".github/workflows/lambda-ci-p5-gpu-autonomous.yml",
            "default_branch": "main",
            "blob_sha": "e02e35306ae82c4ba393631cbaa1521ca53a28b4",
            "job_key": "autonomous-gpu",
            "allowed_events": [
              "issue_comment"
            ],
            "allowed_actor_logins": [
              "adamtrott78"
            ]
          },
          "ingress": {
            "command": "/lambda-ci-p5-gpu",
            "parameter_schema_id": "candidate-sha-v1"
          }
        },
        "model-eval-single-gpu": {
          "runner_class_id": "research-model-single-offline-v1",
          "trusted_workflow": {
            "path": ".github/workflows/lambda-ci-qwen35-offline-pilot.yml",
            "default_branch": "main",
            "blob_sha": "31d77703d434b248aa50adf93568f9a13b89dc07",
            "job_key": "qwen35-offline-pilot",
            "allowed_events": [
              "issue_comment"
            ],
            "allowed_actor_logins": [
              "adamtrott78"
            ]
          },
          "ingress": {
            "command": "/lambda-ci-qwen35-pilot",
            "parameter_schema_id": "candidate-sha-v1"
          }
        },
        "model-eval-dual-gpu": {
          "runner_class_id": "research-model-dual-offline-v1",
          "trusted_workflow": {
            "path": ".github/workflows/lambda-ci-qwen35-dual-offline-pilot.yml",
            "default_branch": "main",
            "blob_sha": "a961158615269797837e036fb4cc4a3358f60189",
            "job_key": "qwen35-dual-offline-pilot",
            "allowed_events": [
              "issue_comment"
            ],
            "allowed_actor_logins": [
              "adamtrott78"
            ]
          },
          "ingress": {
            "command": "/lambda-ci-qwen35-dual-pilot",
            "parameter_schema_id": "candidate-sha-v1"
          }
        },
        "model-eval-local-extract-wave1": {
          "runner_class_id": "research-model-dual-public-v1",
          "trusted_workflow": {
            "path": ".github/workflows/lambda-ci-local-extract-wave1.yml",
            "default_branch": "main",
            "blob_sha": "a5be693f750c481db21d86d239a505083aae40aa",
            "job_key": "local-extract-wave1",
            "allowed_events": [
              "issue_comment"
            ],
            "allowed_actor_logins": [
              "adamtrott78"
            ]
          },
          "ingress": {
            "command": "/lambda-ci-local-extract-wave1",
            "parameter_schema_id": "candidate-sha-v1"
          }
        },
        "model-eval-local-extract-wave2": {
          "runner_class_id": "research-model-dual-public-v1",
          "trusted_workflow": {
            "path": ".github/workflows/lambda-ci-local-extract-wave2.yml",
            "default_branch": "main",
            "blob_sha": "cb7fd59bcb6f857bd6148ecbc7e2eb320dc9a1fb",
            "job_key": "local-extract-wave2",
            "allowed_events": [
              "issue_comment"
            ],
            "allowed_actor_logins": [
              "adamtrott78"
            ]
          },
          "ingress": {
            "command": "/lambda-ci-local-extract-wave2",
            "parameter_schema_id": "candidate-sha-v1"
          }
        },
        "model-eval-local-extract-wave3": {
          "runner_class_id": "research-model-dual-public-v1",
          "trusted_workflow": {
            "path": ".github/workflows/lambda-ci-local-extract-wave3.yml",
            "default_branch": "main",
            "blob_sha": "db45f163e9e8b342d78c04540f0ace10fcba5906",
            "job_key": "local-extract-wave3",
            "allowed_events": [
              "issue_comment"
            ],
            "allowed_actor_logins": [
              "adamtrott78"
            ]
          },
          "ingress": {
            "command": "/lambda-ci-local-extract-wave3",
            "parameter_schema_id": "candidate-sha-v1"
          }
        },
        "model-eval-local-extract-wave4": {
          "runner_class_id": "research-model-dual-public-v1",
          "trusted_workflow": {
            "path": ".github/workflows/lambda-ci-local-extract-wave4.yml",
            "default_branch": "main",
            "blob_sha": "71641ec390a514c5f6f046a1cb00eed9e43f839e",
            "job_key": "local-extract-wave4",
            "allowed_events": [
              "issue_comment"
            ],
            "allowed_actor_logins": [
              "adamtrott78"
            ]
          },
          "ingress": {
            "command": "/lambda-ci-local-extract-wave4",
            "parameter_schema_id": "candidate-sha-v1"
          }
        },
        "model-eval-local-extract-wave5": {
          "runner_class_id": "research-model-dual-public-v1",
          "trusted_workflow": {
            "path": ".github/workflows/lambda-ci-local-extract-wave5.yml",
            "default_branch": "main",
            "blob_sha": "2ef10f5b0940ff3c2238f74c0f0efbaf5bd61d6d",
            "job_key": "local-extract-wave5",
            "allowed_events": [
              "issue_comment"
            ],
            "allowed_actor_logins": [
              "adamtrott78"
            ]
          },
          "ingress": {
            "command": "/lambda-ci-local-extract-wave5",
            "parameter_schema_id": "candidate-sha-v1"
          }
        },
        "model-eval-local-extract-wave6": {
          "runner_class_id": "research-model-dual-public-v1",